{
  "format": "sparkium-scene",
  "version": 1,
  "name": "Sparkium Textured PBR",
  "film": {
    "width": 2048,
    "height": 1024,
    "persistence": 1.0,
    "clamping": 100.0,
    "max_exposure": 16.0
  },
  "renderer": {
    "pipeline": "auto",
    "samples_per_dispatch": 16,
    "max_bounces": 32,
    "alpha_shadow": false,
    "ambient_light": [
      0.2,
      0.2,
      0.2
    ]
  },
  "camera": {
    "eye": [
      -5,
      0.3,
      7
    ],
    "target": [
      0,
      0,
      0
    ],
    "up": [
      0,
      1,
      0
    ],
    "fov_degrees": 30
  },
  "materials": {
    "metal": {
      "type": "principled",
      "base_color": [
        0.8,
        0.8,
        0.8
      ],
      "textures": {
        "base_color": "textures/metal/Metal053C_2K-PNG_Color.png",
        "roughness": "textures/metal/Metal053C_2K-PNG_Roughness.png",
        "metallic": "textures/metal/Metal053C_2K-PNG_Metalness.png",
        "normal": "textures/metal/Metal053C_2K-PNG_NormalGL.png"
      }
    },
    "ornament": {
      "type": "principled",
      "base_color": [
        0.8,
        0.8,
        0.8
      ],
      "textures": {
        "base_color": "textures/ornament/ChristmasTreeOrnament013_4K-JPG_Color.jpg",
        "roughness": "textures/ornament/ChristmasTreeOrnament013_4K-JPG_Roughness.jpg",
        "metallic": "textures/ornament/ChristmasTreeOrnament013_4K-JPG_Metalness.jpg",
        "normal": "textures/ornament/ChristmasTreeOrnament013_4K-JPG_NormalGL.jpg"
      }
    },
    "copper": {
      "type": "principled",
      "base_color": [
        0.8,
        0.8,
        0.8
      ],
      "textures": {
        "base_color": "textures/copper/Sphere_Base_color.png",
        "roughness": "textures/copper/Sphere_Roughness.png",
        "metallic": "textures/copper/Sphere_Metallic.png",
        "normal": "textures/copper/Sphere_Normal.png",
        "anisotropic": "textures/copper/Sphere_Anisotropy_level.png",
        "anisotropic_rotation": "textures/copper/Sphere_Anisotropy_angle.png"
      }
    },
    "glass": {
      "type": "principled",
      "base_color": [
        1,
        1,
        1
      ],
      "roughness": 0.1,
      "transmission": 1,
      "ior": 1.3
    },
    "ground": {
      "type": "principled",
      "base_color": [
        0.7,
        0.7,
        0.7
      ],
      "roughness": 0.2,
      "metallic": 1
    },
    "sky": {
      "type": "light",
      "emission": [
        0.8,
        0.8,
        0.8
      ],
      "two_sided": true
    },
    "area": {
      "type": "light",
      "emission": [
        1000,
        1000,
        1000
      ]
    }
  },
  "geometries": {
    "matball": {
      "type": "mesh",
      "path": "meshes/preview_sphere.obj",
      "generate_tangents": true
    },
    "cube": {
      "type": "mesh",
      "path": "meshes/cube.obj"
    },
    "sphere": {
      "type": "sphere",
      "longitude_segments": 30
    },
    "quad": {
      "type": "inline_mesh",
      "positions": [
        [
          -1,
          -1,
          0
        ],
        [
          1,
          -1,
          0
        ],
        [
          1,
          1,
          0
        ],
        [
          -1,
          1,
          0
        ]
      ],
      "indices": [
        0,
        2,
        1,
        0,
        3,
        2
      ]
    }
  },
  "entities": [
    {
      "type": "mesh",
      "geometry": "matball",
      "material": "metal",
      "transform": {
        "translation": [
          -2.2,
          0,
          0
        ]
      }
    },
    {
      "type": "mesh",
      "geometry": "matball",
      "material": "ornament",
      "transform": {
        "translation": [
          0,
          0,
          0
        ]
      }
    },
    {
      "type": "mesh",
      "geometry": "matball",
      "material": "copper",
      "transform": {
        "translation": [
          2.2,
          0,
          0
        ]
      }
    },
    {
      "type": "mesh",
      "geometry": "matball",
      "material": "glass",
      "transform": {
        "translation": [
          4.4,
          0,
          0
        ]
      }
    },
    {
      "type": "mesh",
      "geometry": "cube",
      "material": "ground",
      "transform": {
        "translation": [
          0,
          -1001,
          0
        ],
        "scale": [
          1000,
          1000,
          1000
        ]
      }
    },
    {
      "type": "mesh",
      "geometry": "sphere",
      "material": "sky",
      "transform": {
        "translation": [
          0,
          0,
          0
        ],
        "scale": [
          60,
          60,
          60
        ]
      },
      "raster_light": false
    },
    {
      "type": "mesh",
      "geometry": "quad",
      "material": "area",
      "look_at": {
        "position": [
          0,
          30,
          50
        ],
        "target": [
          0,
          27,
          45
        ],
        "up": [
          0,
          1,
          0
        ],
        "scale": [
          1,
          1,
          1
        ]
      }
    }
  ]
}
